{
  "schemaVersion": 1,
  "color": {
    "light": {
      "canvas": "#FFFFFF",
      "surface": "#F5F6F7",
      "surfaceElevated": "#FFFFFF",
      "textPrimary": "#1F2329",
      "textSecondary": "#5A626E",
      "textMuted": "#626A75",
      "border": "#E4E6E9",
      "borderStrong": "#D5D9DF",
      "accent": "#4467B8",
      "accentHover": "#365DA9",
      "accentSubtle": "#EAF0FF",
      "onAccent": "#FFFFFF",
      "info": "#2D5F8C",
      "infoSubtle": "#E8F0F7",
      "warning": "#744B0B",
      "warningSubtle": "#F8EDD8",
      "danger": "#8B352E",
      "dangerSubtle": "#F8E9E7",
      "rail": "#173D35",
      "onRail": "#FFFFFF",
      "focusRing": "#1456F0",
      "chrome": "#FAFBFC",
      "surfaceHover": "#ECEFF3",
      "selection": "#E5EDFF",
      "unread": "#B82F38",
      "navigationSurface": "#EAF0F8"
    },
    "dark": {
      "canvas": "#101713",
      "surface": "#17211D",
      "surfaceElevated": "#1E2A25",
      "textPrimary": "#F4F7F5",
      "textSecondary": "#CDD7D2",
      "textMuted": "#A7B3AD",
      "border": "#35443D",
      "borderStrong": "#4A5B53",
      "accent": "#6FC6AB",
      "accentHover": "#8AD7BE",
      "accentSubtle": "#213E34",
      "onAccent": "#071C15",
      "info": "#83B6E0",
      "infoSubtle": "#203545",
      "warning": "#E7B864",
      "warningSubtle": "#3D301A",
      "danger": "#F09A91",
      "dangerSubtle": "#422522",
      "rail": "#0B2721",
      "onRail": "#F4F7F5",
      "focusRing": "#82B8FF",
      "chrome": "#17211D",
      "surfaceHover": "#1E2A25",
      "selection": "#213E34",
      "unread": "#F09A91",
      "navigationSurface": "#17211D"
    },
    "highContrastLight": {
      "canvas": "#FFFFFF",
      "surface": "#FFFFFF",
      "surfaceElevated": "#FFFFFF",
      "textPrimary": "#000000",
      "textSecondary": "#1A1A1A",
      "textMuted": "#333333",
      "border": "#000000",
      "borderStrong": "#000000",
      "accent": "#004C3E",
      "accentHover": "#00382E",
      "accentSubtle": "#D6F5EA",
      "onAccent": "#FFFFFF",
      "info": "#004C9E",
      "infoSubtle": "#DCEBFF",
      "warning": "#5C3900",
      "warningSubtle": "#FFF0C2",
      "danger": "#7A1710",
      "dangerSubtle": "#FFE3E0",
      "rail": "#000000",
      "onRail": "#FFFFFF",
      "focusRing": "#005FCC",
      "chrome": "#FFFFFF",
      "surfaceHover": "#FFFFFF",
      "selection": "#D6F5EA",
      "unread": "#7A1710",
      "navigationSurface": "#FFFFFF"
    },
    "highContrastDark": {
      "canvas": "#000000",
      "surface": "#000000",
      "surfaceElevated": "#0D0D0D",
      "textPrimary": "#FFFFFF",
      "textSecondary": "#F2F2F2",
      "textMuted": "#D9D9D9",
      "border": "#FFFFFF",
      "borderStrong": "#FFFFFF",
      "accent": "#73F2C6",
      "accentHover": "#A4FFDF",
      "accentSubtle": "#123E31",
      "onAccent": "#000000",
      "info": "#8FC7FF",
      "infoSubtle": "#173A5E",
      "warning": "#FFD166",
      "warningSubtle": "#493700",
      "danger": "#FF9E95",
      "dangerSubtle": "#501A16",
      "rail": "#000000",
      "onRail": "#FFFFFF",
      "focusRing": "#A8D1FF",
      "chrome": "#000000",
      "surfaceHover": "#0D0D0D",
      "selection": "#123E31",
      "unread": "#FF9E95",
      "navigationSurface": "#000000"
    }
  },
  "typography": {
    "caption": { "webRem": 0.75, "lineHeight": 1.4, "weight": 500, "swiftTextStyle": "caption1", "androidSp": 12 },
    "label": { "webRem": 0.875, "lineHeight": 1.4, "weight": 600, "swiftTextStyle": "subheadline", "androidSp": 14 },
    "body": { "webRem": 1, "lineHeight": 1.5, "weight": 400, "swiftTextStyle": "body", "androidSp": 16 },
    "bodyEmphasis": { "webRem": 1, "lineHeight": 1.5, "weight": 600, "swiftTextStyle": "headline", "androidSp": 16 },
    "title": { "webRem": 1.25, "lineHeight": 1.3, "weight": 650, "swiftTextStyle": "title3", "androidSp": 20 },
    "display": { "webRem": 1.75, "lineHeight": 1.2, "weight": 700, "swiftTextStyle": "title1", "androidSp": 28 },
    "mono": { "webRem": 0.875, "lineHeight": 1.6, "weight": 400, "swiftTextStyle": "body", "androidSp": 14 }
  },
  "space": {
    "none": 0,
    "xxs": 0.125,
    "xs": 0.25,
    "sm": 0.375,
    "md": 0.5,
    "lg": 0.75,
    "xl": 1,
    "2xl": 1.5,
    "3xl": 2,
    "4xl": 3
  },
  "radius": { "none": 0, "sm": 0.25, "md": 0.375, "lg": 0.5, "control": 0.625, "xl": 0.75, "full": 9999 },
  "layer": { "base": 0, "sticky": 100, "overlay": 400, "modal": 600, "toast": 800 },
  "motion": {
    "durationMs": { "instant": 0, "fast": 120, "standard": 180, "slow": 260 },
    "easing": {
      "standard": "cubic-bezier(0.22, 0.72, 0.25, 1)",
      "enter": "cubic-bezier(0.16, 1, 0.3, 1)",
      "exit": "cubic-bezier(0.4, 0, 1, 1)"
    },
    "reducedMotion": { "durationMultiplier": 0, "distanceMultiplier": 0, "allowOpacity": true, "essentialOnly": true }
  },
  "accessibility": {
    "minimumContrast": 4.5,
    "maximumTextScale": 2,
    "contrastPairs": [
      { "foreground": "textPrimary", "background": "canvas", "minimum": 4.5 },
      { "foreground": "textSecondary", "background": "canvas", "minimum": 4.5 },
      { "foreground": "textMuted", "background": "canvas", "minimum": 4.5 },
      { "foreground": "accent", "background": "canvas", "minimum": 4.5 },
      { "foreground": "onAccent", "background": "accent", "minimum": 4.5 },
      { "foreground": "info", "background": "canvas", "minimum": 4.5 },
      { "foreground": "warning", "background": "canvas", "minimum": 4.5 },
      { "foreground": "danger", "background": "canvas", "minimum": 4.5 },
      { "foreground": "onRail", "background": "rail", "minimum": 4.5 },
      { "foreground": "focusRing", "background": "canvas", "minimum": 3 },
      { "foreground": "accent", "background": "selection", "minimum": 4.5 },
      { "foreground": "textSecondary", "background": "chrome", "minimum": 4.5 },
      { "foreground": "textMuted", "background": "surface", "minimum": 4.5 },
      { "foreground": "unread", "background": "surface", "minimum": 4.5 },
      { "foreground": "textPrimary", "background": "navigationSurface", "minimum": 4.5 },
      { "foreground": "textSecondary", "background": "navigationSurface", "minimum": 4.5 },
      { "foreground": "textMuted", "background": "navigationSurface", "minimum": 4.5 },
      { "foreground": "unread", "background": "navigationSurface", "minimum": 4.5 }
    ]
  }
}
